[
  {
    "ruleId": "03f31a64-3c7a-4543-8085-e69373f991d7",
    "question": "Do you have Definition of Ready criteria to take user story in sprint?",
    "tags": [
      "role:ba"
    ],
    "statement": "Introduce 'Definition of Ready' criteria to take user story in sprint."
  },
  {
    "ruleId": "313c4446-7f4f-4d93-b2c3-7454b173c17a",
    "question": "Do you have Definition of Done for user stories and sprint?",
    "tags": [
      "role:pm",
      "role:po"
    ],
    "statement": "Introduce 'Definition of Done' for user stories and sprint."
  },
  {
    "ruleId": "ff0ba187-b653-4bbd-b09d-dfe41286e714",
    "question": "Does team track sprint burn-down chart?",
    "tags": [
      "role:pm",
      "role:ba",
      "role:dev",
      "role:devops",
      "role:qa"
    ],
    "statement": "Track sprint burn-down chart."
  },
  {
    "ruleId": "a0cb34ea-eabb-46df-aabd-5349c0bc8705",
    "question": "Does team deliver software to the customer at the end of every sprint?",
    "tags": [
      "role:pm",
      "role:ba",
      "role:dev",
      "role:devops",
      "role:qa"
    ],
    "statement": "Ensure software delivery to the customer at the end of every sprint."
  },
  {
    "ruleId": "76e00546-61c1-425b-b503-a54e4e0d8b22",
    "question": "Is your sprint/iteration duration less than or equal to 2 weeks?",
    "tags": [
      "role:pm",
      "sdlc"
    ],
    "statement": "Ensure sprint/iteration duration is less than or equal to 2 weeks."
  },
  {
    "ruleId": "d3384f33-afac-4ee1-ab3b-d3d9052b0c7e",
    "question": "Do you have backlog grooming/refinement sessions before the start of each sprint/iteration?",
    "tags": [
      "role:pm"
    ],
    "statement": "Introduce backlog grooming/refinement sessions before the start of each sprint/iteration."
  },
  {
    "ruleId": "a6e5f7ad-fc58-4668-90b8-91d862191977",
    "question": "Are user stories accepted by a customer or product owner before sprint starting a sprint/iteration?",
    "tags": [
      "role:pm",
      "role:po"
    ],
    "statement": "Ensure user stories are accepted by a customer or product owner before starting a sprint/iteration."
  }
]
